{
  "schema_version": "1.0",
  "id": "a1b2c3d4-0003-4000-8000-000000000003",
  "kind": "Type",
  "name": "RefundResponse",
  "spec": {
    "fields": {
      "refund_id": { "type": "uuid", "required": true },
      "status": { "type": "RefundStatus", "required": true },
      "message": { "type": "string", "required": true }
    }
  }
}
