{
  "id": "550e8400-e29b-41d4-a716-446655440001",
  "kind": "Type",
  "name": "RefundRequest",
  "schema_version": "1.0",
  "spec": {
    "fields": {
      "amount": {
        "required": true,
        "type": "money"
      },
      "order_id": {
        "required": true,
        "type": "uuid"
      },
      "reason": {
        "required": false,
        "type": "optional<string>"
      }
    }
  }
}
